{
  "id": "product-asset-example-001",
  "showcase_pack_id": "fastapi-llm-backend",
  "asset_type": "portfolio_demo",
  "status": "ready",
  "target_category": "FastAPI backend",
  "proposal_use_case": "Show proof for typed API and LLM endpoint work.",
  "evidence_url": "portfolio/demo-fastapi-llm",
  "gap_reason": "No gap for basic FastAPI LLM backend proposals.",
  "priority": "high",
  "created_at": "2026-05-10T00:00:00Z"
}
